{"digest":"sha256:693d2b4a1db729d86b46a9daeae792fc74b98152d55490c46965a9199ff5d025","invocation":{"emitted_at":"2026-08-07T03:33:41.682146+00:00","first_event_at":"2026-08-07T00:00:00Z","last_event_at":"2026-08-07T00:06:00Z"},"lanes":[{"attempt":1,"attempted_provider":"openrouter","cache_read_usage_count":64,"cache_write_usage_count":0,"chunk_id":"01-openrouter-usage-translator","cost_usd":0.6670722,"duration_seconds":431.0,"host":"claude-code","implemented_by":"openrouter","input_usage_count":24410,"lane":"01-openrouter-usage-translator","measurement_source":"openrouter_api_receipt","model":"moonshotai/kimi-k3","output_usage_count":39601,"provider":"Modal","reasoning_usage_count":34999,"requested_provider":"openrouter","usage_count":64011,"usage_estimated":false,"wait_category":null},{"attempt":1,"attempted_provider":"openrouter","cache_read_usage_count":64,"cache_write_usage_count":0,"chunk_id":"02-lane-input-bytes","cost_usd":0.6608562,"duration_seconds":400.0,"host":"claude-code","implemented_by":"openrouter","input_usage_count":16158,"lane":"02-lane-input-bytes","measurement_source":"openrouter_api_receipt","model":"moonshotai/kimi-k3","output_usage_count":40837,"provider":"Modal","reasoning_usage_count":35155,"requested_provider":"openrouter","usage_count":56995,"usage_estimated":false,"wait_category":null},{"attempt":1,"attempted_provider":"openrouter","cache_read_usage_count":0,"cache_write_usage_count":0,"chunk_id":"03-emission-contract-and-baselines","cost_usd":0.1614712,"duration_seconds":300.0,"host":"claude-code","implemented_by":"openrouter","input_usage_count":20394,"lane":"03-emission-contract-and-baselines","measurement_source":"openrouter_api_receipt","model":"z-ai/glm-5.2","output_usage_count":30209,"provider":"Friendli","reasoning_usage_count":24272,"requested_provider":"openrouter","usage_count":50603,"usage_estimated":false,"wait_category":null},{"attempt":1,"attempted_provider":"openrouter","cache_read_usage_count":64,"cache_write_usage_count":0,"chunk_id":"adversary-r1","cost_usd":0.6914922,"duration_seconds":3600.0,"host":"claude-code","implemented_by":"openrouter","input_usage_count":52660,"lane":"adversary-r1","measurement_source":"openrouter_api_receipt","model":"moonshotai/kimi-k3","output_usage_count":35579,"provider":"Modal","reasoning_usage_count":32395,"requested_provider":"openrouter","usage_count":88239,"usage_estimated":false,"wait_category":null},{"attempt":1,"attempted_provider":"openrouter","cache_read_usage_count":64,"cache_write_usage_count":0,"chunk_id":"adversary-r2","cost_usd":0.8151192,"duration_seconds":900.0,"host":"claude-code","implemented_by":"openrouter","input_usage_count":63769,"lane":"adversary-r2","measurement_source":"openrouter_api_receipt","model":"moonshotai/kimi-k3","output_usage_count":41599,"provider":"Modal","reasoning_usage_count":41182,"requested_provider":"openrouter","usage_count":105368,"usage_estimated":false,"wait_category":null}],"measurement_coverage":{"cost":{"estimated":0,"expected":5,"measured":5,"missing":0,"overlap":0,"unassigned":0},"usage":{"estimated":0,"expected":5,"measured":5,"missing":0,"overlap":0,"unassigned":0}},"phases":[{"attempted_provider":"openrouter","cache_read_usage_count":256,"cache_write_usage_count":0,"cost_usd":2.996011,"duration_seconds":5631.0,"host":"claude-code","implemented_by":"openrouter","input_usage_count":177391,"measurement_source":"openrouter_api_receipt","model":"moonshotai/kimi-k3","output_usage_count":187825,"phase":"attempt_usage","provider":"Modal","reasoning_usage_count":168003,"requested_provider":"openrouter","usage_count":365216,"usage_estimated":false,"wait_category":null},{"attempted_provider":null,"cache_read_usage_count":null,"cache_write_usage_count":null,"cost_usd":null,"duration_seconds":null,"host":"claude-code","implemented_by":null,"input_usage_count":null,"measurement_source":"unavailable","model":null,"output_usage_count":null,"phase":"manifest_validation","provider":null,"reasoning_usage_count":null,"requested_provider":null,"usage_count":null,"usage_estimated":false,"wait_category":null},{"attempted_provider":null,"cache_read_usage_count":null,"cache_write_usage_count":null,"cost_usd":null,"duration_seconds":null,"host":"claude-code","implemented_by":null,"input_usage_count":null,"measurement_source":"unavailable","model":null,"output_usage_count":null,"phase":"run_summary","provider":null,"reasoning_usage_count":null,"requested_provider":null,"usage_count":null,"usage_estimated":false,"wait_category":null}],"run_identity":{"dirty_state":true,"repository_commit":"bbe3e016612265425128cf9d749f6d2d22096349","run_id":"r0-measurement-backbone","workflow_class":"feature"},"schema_version":1,"totals":{"cache_read_usage_count":256,"cache_write_usage_count":0,"cost_provenance":"derived_complete_attempts","cost_usd":2.996011,"input_usage_count":177391,"output_usage_count":187825,"reasoning_usage_count":168003,"usage_count":365216,"usage_provenance":{"cache_read_usage_count":"derived_complete_attempts","cache_write_usage_count":"derived_complete_attempts","input_usage_count":"derived_complete_attempts","output_usage_count":"derived_complete_attempts","reasoning_usage_count":"derived_complete_attempts","usage_count":"derived_complete_attempts"}},"versions":{"kernel_version":"0.9.0"},"volatile_fields":["invocation.emitted_at"]}
