{"digest":"sha256:26956f15ded663fae45b12f65ce35b8ed734ed7e531d52fc324044c3e5625441","invocation":{"emitted_at":"2026-08-07T03:19:39.598279+00:00","first_event_at":"2026-07-22T02:53:35Z","last_event_at":"2026-07-22T07:23:07Z"},"lanes":[],"measurement_coverage":{"cost":{"estimated":0,"expected":6,"measured":0,"missing":6,"overlap":0,"unassigned":0},"usage":{"estimated":0,"expected":6,"measured":0,"missing":6,"overlap":0,"unassigned":0}},"phases":[{"attempted_provider":null,"cache_read_usage_count":null,"cache_write_usage_count":null,"cost_usd":null,"duration_seconds":null,"host":"codex","implemented_by":null,"input_usage_count":null,"measurement_source":"unavailable","model":null,"output_usage_count":null,"phase":"chunk_cleanup","provider":null,"reasoning_usage_count":null,"requested_provider":null,"usage_count":null,"usage_estimated":false,"wait_category":null},{"attempted_provider":null,"cache_read_usage_count":null,"cache_write_usage_count":null,"cost_usd":null,"duration_seconds":null,"host":"codex","implemented_by":null,"input_usage_count":null,"measurement_source":"unavailable","model":null,"output_usage_count":null,"phase":"dependency_ready","provider":null,"reasoning_usage_count":null,"requested_provider":null,"usage_count":null,"usage_estimated":false,"wait_category":null},{"attempted_provider":null,"cache_read_usage_count":null,"cache_write_usage_count":null,"cost_usd":null,"duration_seconds":null,"host":"codex","implemented_by":null,"input_usage_count":null,"measurement_source":"unavailable","model":null,"output_usage_count":null,"phase":"deterministic_validation","provider":null,"reasoning_usage_count":null,"requested_provider":null,"usage_count":null,"usage_estimated":false,"wait_category":null},{"attempted_provider":"codex","cache_read_usage_count":null,"cache_write_usage_count":null,"cost_usd":null,"duration_seconds":null,"host":"codex","implemented_by":"codex","input_usage_count":null,"measurement_source":"unavailable","model":null,"output_usage_count":null,"phase":"dispatch","provider":"openai","reasoning_usage_count":null,"requested_provider":"openrouter","usage_count":null,"usage_estimated":false,"wait_category":null},{"attempted_provider":null,"cache_read_usage_count":null,"cache_write_usage_count":null,"cost_usd":null,"duration_seconds":null,"host":"codex","implemented_by":null,"input_usage_count":null,"measurement_source":"unavailable","model":null,"output_usage_count":null,"phase":"evaluation_gate","provider":null,"reasoning_usage_count":null,"requested_provider":null,"usage_count":null,"usage_estimated":false,"wait_category":null},{"attempted_provider":null,"cache_read_usage_count":null,"cache_write_usage_count":null,"cost_usd":null,"duration_seconds":null,"host":"codex","implemented_by":null,"input_usage_count":null,"measurement_source":"unavailable","model":null,"output_usage_count":null,"phase":"final_dm_review","provider":null,"reasoning_usage_count":null,"requested_provider":null,"usage_count":null,"usage_estimated":false,"wait_category":null},{"attempted_provider":null,"cache_read_usage_count":null,"cache_write_usage_count":null,"cost_usd":null,"duration_seconds":null,"host":"codex","implemented_by":null,"input_usage_count":null,"measurement_source":"unavailable","model":null,"output_usage_count":null,"phase":"manifest_validation","provider":null,"reasoning_usage_count":null,"requested_provider":null,"usage_count":null,"usage_estimated":false,"wait_category":null},{"attempted_provider":null,"cache_read_usage_count":null,"cache_write_usage_count":null,"cost_usd":null,"duration_seconds":null,"host":"codex","implemented_by":null,"input_usage_count":null,"measurement_source":"unavailable","model":null,"output_usage_count":null,"phase":"merge_disposition","provider":null,"reasoning_usage_count":null,"requested_provider":null,"usage_count":null,"usage_estimated":false,"wait_category":null},{"attempted_provider":null,"cache_read_usage_count":null,"cache_write_usage_count":null,"cost_usd":null,"duration_seconds":null,"host":"codex","implemented_by":null,"input_usage_count":null,"measurement_source":"unavailable","model":null,"output_usage_count":null,"phase":"requirements_cross_check","provider":null,"reasoning_usage_count":null,"requested_provider":null,"usage_count":null,"usage_estimated":false,"wait_category":null},{"attempted_provider":null,"cache_read_usage_count":null,"cache_write_usage_count":null,"cost_usd":null,"duration_seconds":null,"host":"codex","implemented_by":null,"input_usage_count":null,"measurement_source":"unavailable","model":null,"output_usage_count":null,"phase":"run_summary","provider":null,"reasoning_usage_count":null,"requested_provider":null,"usage_count":null,"usage_estimated":false,"wait_category":null},{"attempted_provider":null,"cache_read_usage_count":null,"cache_write_usage_count":null,"cost_usd":null,"duration_seconds":null,"host":"codex","implemented_by":null,"input_usage_count":null,"measurement_source":"unavailable","model":null,"output_usage_count":null,"phase":"terminal_reconciliation","provider":null,"reasoning_usage_count":null,"requested_provider":null,"usage_count":null,"usage_estimated":false,"wait_category":null}],"run_identity":{"dirty_state":true,"repository_commit":"e222e25ed6a88797331ecac18a4868f8923c37f2","run_id":"adaptive-fusion-verification","workflow_class":"feature"},"schema_version":1,"totals":{"cache_read_usage_count":null,"cache_write_usage_count":null,"cost_provenance":null,"cost_usd":null,"input_usage_count":null,"output_usage_count":null,"reasoning_usage_count":null,"usage_count":null,"usage_provenance":{"cache_read_usage_count":null,"cache_write_usage_count":null,"input_usage_count":null,"output_usage_count":null,"reasoning_usage_count":null,"usage_count":null}},"versions":{"kernel_version":"0.9.0"},"volatile_fields":["invocation.emitted_at"]}
